{
  "essay_id": "something-big-is-happening",
  "essay_path": "/Users/nancywu/Tapia_the-ascent/data/essays/shumer.md",
  "essay_url": "https://shumer.dev/something-big-is-happening",
  "generated_at": "2026-09-18T18:29:07.774377+00:00",
  "agent": "run_claim_checker.py + qwen2.5:3b",
  "claims": [
    {
      "id": "c01",
      "quote": "I've been building an experimental agent that works alongside you on its own computer, helping with the messy parts of getting things done.",
      "claim_type": "opinion",
      "verdict": "opinion",
      "confidence": 0.7,
      "sources": [],
      "why": "Classified as non-checkable; no external lookup required.",
      "label": "opinion"
    },
    {
      "id": "c02",
      "quote": "If you were paying close attention, you might have noticed a few people talking about a virus spreading overseas.",
      "claim_type": "verifiable_external",
      "verdict": "misleading",
      "confidence": 0.8,
      "sources": [
        {
          "title": "- CORONAVIRUS PREPAREDNESS AND RESPONSE",
          "url": "https://www.govinfo.gov/content/pkg/CHRG-116hhrg40428/html/CHRG-116hhrg40428.htm",
          "quote": "South Korea can test more people in one day than we tested over the past two months. So, Dr. Fauci, why are we so far behind Korea in testing and reporting this crisis? Dr. Fauci. Thank you very much, Chairwoman Maloney. I would--I don't like to pass the buck, but Dr. Redfield has the numbers and a little map that he might want to show you about that because I don't have that in front of me. Chair"
        },
        {
          "title": "Press briefing by the international team studying the origins of the COVID-19 virus \u2013 30 March 2021",
          "url": "https://www.who.int/publications/m/item/press-briefing-by-the-international-team-studying-the-origins-of-the-covid-19-virus-30-march-2021",
          "quote": "And they had done testing for SARS-CoV-2 antibodies and found those to be negative, which is some indication. And we also had the opportunity to talk to the scientists in the laboratory about the type of work they were doing. And again, as we know from the report, the most closely related bat coronavirus 2, SARS-CoV-2, the so-called RaTG13, in fact, has not been isolated in the laboratory, but is,"
        }
      ],
      "why": "one sentence",
      "label": "verifiable"
    },
    {
      "id": "c03",
      "quote": "Then, on February 5th, two major AI labs released new models on the same day: GPT-5.3 Codex from OpenAI, and Opus 4.6 from Anthropic (the makers of Claude, one of the main competitors to ChatGPT).",
      "claim_type": "verifiable_external",
      "verdict": "supported",
      "confidence": 0.9,
      "sources": [
        {
          "title": "GPT-5.3-Codex - Wikipedia",
          "url": "https://en.wikipedia.org/wiki/GPT-5.3-Codex",
          "quote": "GPT-5.3-Codex (Generative Pre-trained Transformer 5.3 Codex) is a large language model (LLM) announced and released by OpenAI on February 5, 2026. [1] It is made as a competitor to Claude 's Opus 4.6, focusing on code generation, speed and the ability to search repositories, run terminal commands and at the same time, debug code. [citation needed] In technical benchmarks, it is reported that ..."
        },
        {
          "title": "Anthropic and OpenAI Release Dueling AI Models on the Same Day ...",
          "url": "https://www.businessinsider.com/anthropic-openai-rivalry-dueling-ai-models-on-the-same-day-2026-2?op=1",
          "quote": "The rivaling AI companies pushed GPT-5.3-Codex and Claude Opus 4.6, and had back-to-back appearances on a tech and business podcast."
        }
      ],
      "why": "the sources quote the exact claim with minor differences in wording",
      "label": "verifiable"
    },
    {
      "id": "c04",
      "quote": "I am no longer needed for the actual technical work of my job. I describe what I want built, in plain English, and it just... appears.",
      "claim_type": "verifiable_external",
      "verdict": "supported",
      "confidence": 0.95,
      "sources": [
        {
          "title": "Something big is happening in AI \u2014 and most people will be blindsided | Fortune",
          "url": "https://fortune.com/2026/02/11/something-big-is-happening-ai-february-2020-moment-matt-shumer/",
          "quote": "February 20, 2026 - I describe what I want built, in plain English, and it just\u2026 appears. Not a rough draft I need to fix. The finished thing. I tell the AI what I want, walk away from my computer for four hours, and come back to find the work done."
        },
        {
          "title": "The End of the Coder? \u2013 Communications of the ACM",
          "url": "https://cacm.acm.org/news/the-end-of-the-coder/",
          "quote": "June 12, 2026 - \u201cI am no longer needed for the actual technical work of my job,\u201d said Matt Shumer, co-founder of Otherside AI, in an essay that went viral on X in early 2026. Shumer described a workflow that has become common among advanced AI users: \u201cI ..."
        }
      ],
      "why": "The sources quote the exact same claim and future date.",
      "label": "verifiable"
    },
    {
      "id": "c05",
      "quote": "The AI labs made a deliberate choice. They focused on making AI great at writing code first... because building AI requires a lot of code.",
      "claim_type": "verifiable_external",
      "verdict": "supported",
      "confidence": 0.9,
      "sources": [
        {
          "title": "These new AI models aren't incremental improvements. This is ...",
          "url": "https://www.linkedin.com/feed/update/urn:li:activity:7427921288737734656/",
          "quote": "A smarter version, which writes better code, which builds an even smarter version. Making AI great at coding was the strategy that unlocks everything else. That's why they did it..."
        },
        {
          "title": "Why AI labs are betting big on AI coding - Fast Company",
          "url": "https://www.fastcompany.com/91557426/why-ai-labs-are-betting-big-on-ai-coding",
          "quote": "Jun 11, 2026 \u00b7 Researchers and executives at big AI labs like OpenAI, Anthropic, and Google talk about AI-generated code a lot. Tools like Anthropic\u2019s Claude Code, OpenAI\u2019s Codex, and Google\u2019s AlphaCode 2..."
        }
      ],
      "why": "The sources quote the claim that AI labs focused on making AI great at writing code first, which aligns with the essay claim.",
      "label": "verifiable"
    },
    {
      "id": "c06",
      "quote": "The models available today are unrecognizable from what existed even six months ago.",
      "claim_type": "verifiable_external",
      "verdict": "supported",
      "confidence": 1.0,
      "sources": [
        {
          "title": "AI is now building the next AI - Thinking Sands",
          "url": "https://jointhinkingsands.substack.com/p/ai-is-now-building-the-next-ai",
          "quote": "February 23, 2026 - The models available today are unrecognizable from what existed even six months ago. The debate about whether AI is \u201creally getting better\u201d or \u201chitting a wall\u201d \u2014 which has been going on for over a year \u2014 is over."
        },
        {
          "title": "AI CEO warns AI's disruption will be 'much bigger' than COVID: 'The people I care about deserve to hear what is coming'",
          "url": "https://www.businessinsider.com/matt-shumer-something-big-is-happening-essay-ai-disruption-2026-2",
          "quote": "February 13, 2026 - Shumer said that many people outside tech wrote off AI years ago after a clunky experience with an early edition of ChatGPT. \"The models available today are unrecognizable from what existed even six months ago,\" he wrote."
        }
      ],
      "why": "the sources quote the exact same claim with minor differences in date",
      "label": "verifiable"
    },
    {
      "id": "c07",
      "quote": "The people building these systems say one to five years. Some say less.",
      "claim_type": "verifiable_external",
      "verdict": "misleading",
      "confidence": 0.8,
      "sources": [
        {
          "title": "When is it time for a Five-Year Plan? | Statistical Modeling, Causal Inference, and Social Science",
          "url": "https://statmodeling.stat.columbia.edu/2026/05/15/when-is-it-time-for-a-five-year-plan/",
          "quote": "May 15, 2026 - I think the idea was that this is about building the next-generation AI, whatever it will be. I hadn\u2019t heard about all this so I did some searching online and I found out that this is the pitch that\u2019s been coming from various software executives. These guys have tons of money, tons of media exposure, and tons of mystique, so it\u2019s no surprise that lots of politicians would fall under"
        },
        {
          "title": "Make Something Wonderful | Steve Jobs",
          "url": "https://book.stevejobsarchive.com/",
          "quote": "And it was a very, very interesting phenomenon, because I think that that\u2019s exactly what\u2019s going to happen as we start to tie these things [computers] together: they\u2019re going to facilitate communication and facilitate bringing people together in the special interests that they have. And we\u2019re about five years away from really solving the problems of hooking these computers together in the office."
        }
      ],
      "why": "the number/name is real but a limitation was dropped",
      "label": "verifiable"
    },
    {
      "id": "c08",
      "quote": "The most recent measurement (Claude Opus 4.5, from November) showed the AI completing tasks that take a human expert nearly five hours.",
      "claim_type": "verifiable_external",
      "verdict": "misleading",
      "confidence": 0.8,
      "sources": [
        {
          "title": "Anthropic's Claude Opus 4.5 can tackle some tasks lasting nearly five hours",